votes,title,link
838,French court issues damages award for violation of GPL (heathermeeker.com),https://heathermeeker.com/2024/02/17/french-court-issues-damages-award-for-violation-of-gpl/
670,Claude 3 model family (anthropic.com),https://www.anthropic.com/news/claude-3-family
274,The hunt for the missing data type (hillelwayne.com),https://www.hillelwayne.com/post/graph-types/
227,New 13- and 15‑inch MacBook Air with M3 chip (apple.com),https://www.apple.com/newsroom/2024/03/apple-unveils-the-new-13-and-15-inch-macbook-air-with-the-powerful-m3-chip/
206,"Yuzu emulator developers settle Nintendo lawsuit, pay $2.4M in damages (twitter.com/oatmealdome)",https://twitter.com/oatmealdome/status/1764704580724576465
