votes,title,link
650,"Elon Musk sues Sam Altman, Greg Brockman, and OpenAI [pdf] (courthousenews.com)",https://www.courthousenews.com/wp-content/uploads/2024/02/musk-v-altman-openai-complaint-sf.pdf
367,JPEG XL and the Pareto Front (cloudinary.com),https://cloudinary.com/blog/jpeg-xl-and-the-pareto-front
355,Fugitive Wirecard COO Jan Marsalek exposed as decade-long GRU spy (theins.ru),https://theins.ru/en/politics/269612
288,CACM Is Now Open Access (acm.org),https://cacm.acm.org/news/cacm-is-now-open-access-2/
215,"The 'Atlanta Magnet Man' is saving our car tires, one bike ride at a time (wabe.org)",https://www.wabe.org/the-atlanta-magnet-man-is-saving-our-car-tires-one-bike-ride-at-a-time/
